<?xml version="1.0" encoding="UTF-8"?>
<!--Sample XML file generated by XMLSpy v2010 (http://www.altova.com)-->
<Profile xsi:noNamespaceSchemaLocation="qualityProfile.xsd" xmlns:xsi="http://www.w3.org/2001/XMLSchema-instance">
    <Data>
        <Name>DEFAULT</Name>
        <Version>1.0</Version>
    </Data>
    <Elements>
        <ModuleProperty>
            <NamingPattern>.*</NamingPattern>
        </ModuleProperty>
        <Resources>
            <LocationPattern>Resources/.*</LocationPattern>
            <Resource>
                <NamingPattern>.*</NamingPattern>
                <Type>JMSConnection</Type>
            </Resource>
        </Resources>
        <Process>
            <NamingPattern>.*</NamingPattern>
            <LocationPattern>Processes/.*</LocationPattern>
        </Process>
        <Descriptors>
            <NamingPattern>.*</NamingPattern>
            <LocationPattern>Service Descriptors/.*</LocationPattern>
        </Descriptors>
        <Schemas>
            <NamingPattern>.*</NamingPattern>
            <LocationPattern>Schemas/.*</LocationPattern>
        </Schemas>
    </Elements>
</Profile>
